{
  "schema": "go-workflow.execution-context-snapshot.v1",
  "snapshot_id": "b0ff1e8cb843448aa92f715873a3ee49",
  "task_id": "autonomy-01",
  "phase": "repair",
  "attempt": 7,
  "strategy": "direct_fix",
  "workspace": {
    "task_id": "autonomy-01",
    "owner": "codex-astra-high",
    "run_id": "autonomy-01-20260919",
    "control_repo": "/Users/viggomeesters/Dev/go-workflow-stack",
    "path": "/Users/viggomeesters/Documents/Codex/2026-09-19/autonomy/work/autonomy-01",
    "branch": "codex/autonomy-01",
    "base_branch": "main",
    "base_commit": "58e3568bd0e552b7b38a69704517f56a57a7acf1",
    "schema": "go-workflow.workspace-state.v1",
    "common_dir": "/Users/viggomeesters/Dev/go-workflow-stack/.git",
    "repository_id": "51c2a12a0f224916b1585e3dfe1bf86f",
    "generation": "902a4a79d55e4b0a80b826495d4321ac",
    "state": "ready"
  },
  "git": {
    "head": "58e3568bd0e552b7b38a69704517f56a57a7acf1",
    "base_commit": "58e3568bd0e552b7b38a69704517f56a57a7acf1",
    "branch": "codex/autonomy-01",
    "index_sha256": "bbff15b5f73500f6397bf366bf6f1f2ccb81ac82d0b6bd9d457fba1c94a419f1",
    "tracked_content_sha256": "c1ef6fb73e81b9ce928d61b49906e4a07633a23bac09d11a53201bcae67bbcb3",
    "files": {
      "docs/architecture-lane.md": {
        "kind": "file",
        "mode": 420,
        "size": 7602,
        "sha256": "ae82370ccf2f07f7c0a4eb7c481880ded81ba02465f83fe26ed0d56dbcc998da"
      },
      "docs/autonomous-campaign.md": {
        "kind": "file",
        "mode": 420,
        "size": 13223,
        "sha256": "8984156307ef05e6f19cb20bed92a0091a1987838521fb56060c23b8a6545e11"
      },
      "go_workflow/campaign_contracts.py": {
        "kind": "file",
        "mode": 420,
        "size": 19218,
        "sha256": "2f2a2dbac62be0dea7ff9ce8b4001886d66cb76e73557018322a1f2239a66932"
      },
      "go_workflow/cli.py": {
        "kind": "file",
        "mode": 420,
        "size": 322591,
        "sha256": "fed144b2517eeee5f462f32ed41c7311f757d9edde667e8c1760ea31d18a3cd6"
      },
      "schemas/campaign-contract.schema.json": {
        "kind": "file",
        "mode": 420,
        "size": 13309,
        "sha256": "84505e73ab0c438553b65764e9e300a5da6983635fab14b86a6424430f07381f"
      },
      "tests/test_autonomy_contracts.py": {
        "kind": "file",
        "mode": 420,
        "size": 17680,
        "sha256": "2749827078addbfff33c9a0848e7056b29b3e7e196c2d3ace91b447d7787af8b"
      }
    }
  },
  "contract_sha256": "1754f0a5b83113bb5feb10a0f143e5f2828692795221fb3f84444aeabd8c0e3c",
  "task_sha256": "720802638906fa9d898aff975c05b4367cf72c889aef0ba7b6df97d833ede2c2",
  "canonical_sources": {
    "/Users/viggomeesters/Dev/go-workflow-stack/.go/project.json": {
      "kind": "file",
      "mode": 420,
      "size": 619,
      "sha256": "a554a32052ccf3065579ee85e19afa1fa0d57b15e2725af766f71a5134ad518f"
    },
    "/Users/viggomeesters/Dev/go-workflow-stack/.go/vision.json": {
      "kind": "file",
      "mode": 420,
      "size": 6023,
      "sha256": "700af6b7aafc398324fe35f1237f97c8c999be1cb8e4244d2fb847ad88c3efb7"
    },
    "/Users/viggomeesters/Dev/go-workflow-stack/.go/architecture-principles.json": {
      "kind": "file",
      "mode": 420,
      "size": 6699,
      "sha256": "08e9fcbfd962412269f9d49e7929e0857e4a047ce728325b57f06b63d05d4a0b"
    },
    "/Users/viggomeesters/Dev/go-workflow-stack/.go/hierarchy.json": {
      "kind": "file",
      "mode": 384,
      "size": 10063,
      "sha256": "964007df77a6399f1e40b9f062f8bcab0302cc6438eace522143093c540827c7"
    },
    "/Users/viggomeesters/Dev/go-workflow-stack/.go/tasks/active/autonomy-01.json": {
      "kind": "file",
      "mode": 384,
      "size": 6279,
      "sha256": "b26536a8077fa4eebccaade2aa5e429c0bb8eb9d9eb39b067256d390ae757bb4"
    },
    "/Users/viggomeesters/Dev/go-workflow-stack/.go/decisions/events.jsonl": {
      "kind": "file",
      "mode": 420,
      "size": 27816,
      "sha256": "9271886b364995dd469bba3a023a541a11223cc42e744324b92b7bd92e729ff2"
    },
    "/Users/viggomeesters/Dev/go-workflow-stack/.go/runs/autonomy-01/model-selection.json": {
      "kind": "file",
      "mode": 384,
      "size": 315,
      "sha256": "a20670dac5f8959697a3796661676e29825b69dfa5876e075d3981eea4ed3e8c"
    },
    "/Users/viggomeesters/Dev/go-workflow-stack/.go/architecture/briefs/architecture-lane-governance.json": {
      "kind": "file",
      "mode": 420,
      "size": 2258,
      "sha256": "5222278f1c539e3782433d231a67a4dd7deec3068bff60f8e602c5beb8c5664c"
    }
  },
  "selected_files": [
    {
      "kind": "instructions",
      "path": "/Users/viggomeesters/Documents/Codex/2026-09-19/autonomy/work/autonomy-01/AGENTS.md",
      "state": {
        "kind": "file",
        "mode": 420,
        "size": 2808,
        "sha256": "819ec98ef940ffb9885aa9a302d6971ddff571b38c02a34691036a6d1081891c"
      }
    }
  ],
  "phase_contract": null,
  "context": {
    "schema": "go-workflow.execution-context.v1",
    "project": {
      "schema": "go-workflow.repo-local.project.v1",
      "kind": "project",
      "id": "go-workflow-stack",
      "name": "Go Workflow Stack",
      "source_of_truth": "repo-local",
      "project_mode": "project",
      "required_stack_version": "0.3.33",
      "stack_ref": "v0.3.33",
      "default_verification": [
        "uv run --no-project --with pytest pytest -q",
        "make check"
      ],
      "links": {
        "repo": ""
      },
      "contract_version": 2,
      "release_profiles": {
        "github-release": {
          "provider": "github-release",
          "remote": "origin",
          "branch": "main",
          "repository": "viggomeesters/go-workflow-stack"
        }
      }
    },
    "vision": {
      "schema": "go-workflow.repo-local.vision.v1",
      "kind": "vision",
      "project": "go-workflow-stack",
      "status": "active",
      "north_star": "Viggo can say only `go`; the agent resolves loose vs repo-local work, repairs the .go contract if needed, then autonomously works toward the defined goal until done, blocked, or budget-exhausted.",
      "wedge": "A repo-local autonomous workflow stack: .go holds vision, principles, hierarchy, tasks, evidence, decisions, and loop state; Hermes/Bertus uses it to run a Ralph/old-go-workflow-style build→verify→critic→repair→ship loop without Viggo spamming micro-commands.",
      "target_user": "Viggo and future autonomous agents continuing this project.",
      "core_promise": "One `go` can turn rough intent into a valid .go contract, split the goal into tasks, claim/execute/recheck/devil/repair/commit/finish each task, self-reflect, capture lessons, and report compactly.",
      "product_principles": [
        "repo-local",
        "goal-first",
        "autonomous-command-train",
        "bounded-loop-persistence",
        "proof-first",
        "feedback-turns-into-tasks",
        "quiet-telegram"
      ],
      "non_goals": [
        "no hidden central execution state",
        "no random feature invention from autonomy",
        "no broad scope expansion without explicit goal fit",
        "no unbounded public/destructive/payment actions",
        "no command-spam handoff back to Viggo",
        "no technical fluff handoff"
      ],
      "success_metrics": [
        "a bare `go` routes correctly between loose work and repo-local .go work",
        "valid .go contract is repaired before execution",
        "open work is split into executable tasks with acceptance and verification",
        "loop continues across tasks without Viggo re-triggering each phase",
        "recheck/devil/self-reflect findings create repairs or follow-up tasks before final done",
        "final report includes commits, verification, and open/blocker state"
      ],
      "planned_direction": {
        "id": "abc-lifecycle",
        "status": "completed",
        "implementation_status": "released_and_verified",
        "target": "Zelfstandig releasbare Go-taken met expliciete model/effortkeuze en hervatbare contextoverdracht; done vereist de afgesproken geverifieerde release.",
        "coordinator_project": "go-workflow-stack",
        "plan_ref": ".go/plans/abc-lifecycle.json",
        "success_metrics": [
          "A: iedere nieuwe releaseplichtige taak heeft gekoppeld bewijs voor checks, review, commit/push, publicatie en eventuele livecontrole.",
          "B: twee opeenvolgende taken gebruiken aantoonbaar verschillende gekozen model/effortprofielen zonder stille terugval.",
          "C: een verse worker hervat een onderbroken actieve taak met actuele code-, fase- en bewijscontext zonder chatgeschiedenis.",
          "Verse templateclones erven de gevalideerde contracten zonder onderhoudsbacklog of fictieve historische releasebewijzen.",
          "Een taak behoudt één gecontroleerde branch/worktree bij modelwissels en herstel; alleen de definitieve geïntegreerde revisie met geldig fase- en releasebewijs kan done worden."
        ],
        "non_goals": [
          "Parallelle builders als standaard",
          "Mid-turn hot-switching zonder bewijs",
          "Vault als execution state",
          "GitHub Actions",
          "Ongekozen productieprovider of automatische privilege-uitbreiding"
        ],
        "legacy_insights_ref": ".go/plans/legacy-insights.json",
        "stack_release": "v0.3.26",
        "template_release": "v0.3.16",
        "completion_note": "Thirteen ABC tasks completed. Opt-in product lifecycle, explicit task/critic models, durable context, primary controller with owned worktrees and serial verified release. Fresh phase workers supported; persistent-session/subagent adapters remain deferred."
      },
      "proposed_directions": [
        {
          "id": "project-orchestration",
          "status": "deferred",
          "implementation_status": "not_started",
          "plan_ref": ".go/plans/project-orchestration.md",